{
  "schemaVersion": 1,
  "createdAt": "2026-09-06T10:32:00.121Z",
  "baseCommit": "b9b051f72fb9e0ce5514f8b646e9e3068ff9359c",
  "changeFingerprintSha256": "91edcb971c7d0df8b8dc087dbe668f2cd0da0cc4182fb10a943724ff5338bbf8",
  "knowledgeSnapshotId": "2026-09-02T12-55-56.022Z-a90bb31d7f8c13df",
  "knowledgeSnapshotSha256": "a90bb31d7f8c13df5505179dc18bfcaeba35f5344c2f624f75ac48ebf3c5e7a8",
  "query": "API易 图片模型 参考图 参数 提示词 Provider 同步请求 超时 重试 评估 发布 Undici dispatcher",
  "affectedPaths": [
    "docs/ai/apiyi/README.md",
    "docs/ai/apiyi/async-runtime.md",
    "docs/ai/apiyi/change-scope.json",
    "docs/ai/apiyi/evidence/2026-09-02-model-catalog-probe.json",
    "docs/ai/apiyi/evidence/2026-09-03-five-model-catalog-review.json",
    "docs/ai/apiyi/evidence/2026-09-03-manual-model-catalog-review.json",
    "docs/ai/apiyi/evidence/2026-09-03-model-catalog-probe.json",
    "docs/ai/apiyi/model-contracts.json",
    "docs/ai/apiyi/model-knowledge.json",
    "docs/ai/apiyi/models/flux-2-pro.md",
    "docs/ai/apiyi/models/gemini-3.1-flash-image.md",
    "docs/ai/apiyi/models/gpt-image-2-vip.md",
    "docs/ai/apiyi/models/gpt-image-2.md",
    "docs/ai/apiyi/models/grok-imagine-image.md",
    "docs/ai/apiyi/models/seedream-5-0-260128.md",
    "docs/ai/apiyi/project-guidance.json",
    "docs/ai/apiyi/reviews/2026-09-02-contract-rebuild.md",
    "docs/ai/apiyi/reviews/2026-09-03-five-model-catalog-review.md",
    "docs/ai/apiyi/reviews/2026-09-03-five-model-scope.md",
    "docs/ai/apiyi/reviews/2026-09-03-manual-model-catalog-review.md",
    "docs/ai/apiyi/reviews/2026-09-03-model-catalog-drift.md",
    "docs/ai/apiyi/site/README.md",
    "docs/ai/apiyi/site/current.json",
    "docs/ai/apiyi/sources.json",
    "docs/ai/evaluation/README.md",
    "docs/ai/evaluation/evaluation-manifest-v1.json",
    "docs/ai/evaluation/evaluation-plan-v1.json",
    "docs/ai/evaluation/evaluation-plan-v2.json",
    "docs/ai/evaluation/golden-set-v1.json",
    "docs/ai/evaluation/node-prompt-parameter-matrix-v1.json",
    "docs/ai/evaluation/prompt-release-registry.json",
    "scripts/apiyi-docs.mjs",
    "scripts/apiyi-kb.mjs",
    "scripts/build-server.ts",
    "scripts/codex-gate.mjs",
    "scripts/evaluation-authorize.ts",
    "scripts/evaluation-manifest.ts",
    "scripts/evaluation-release-preflight.ts",
    "scripts/evaluation-review.ts",
    "scripts/lib/apiyi-knowledge-base.mjs",
    "scripts/node-prompt-parameter-matrix.ts",
    "scripts/write-build-identity.mjs",
    "server/config.ts",
    "server/engine/dag.ts",
    "server/engine/runQueue.ts",
    "server/engine/runner.ts",
    "server/lib/evaluationAuthorizationLedger.ts",
    "server/lib/evaluationCampaign.ts",
    "server/lib/evaluationCodeIdentity.ts",
    "server/lib/evaluationEvidence.ts",
    "server/lib/evaluationEvidenceStore.ts",
    "server/lib/evaluationPromotion.ts",
    "server/lib/evaluationReleaseBuild.ts",
    "server/lib/evaluationReleaseBundle.ts",
    "server/lib/evaluationReleaseRuntime.ts",
    "server/lib/evaluationReviewLedger.ts",
    "server/lib/evaluationRunPolicy.ts",
    "server/lib/generationRecords.ts",
    "server/lib/imageReferenceAccess.ts",
    "server/lib/imageValidation.ts",
    "server/lib/referenceRolePrompt.ts",
    "server/lib/workflowSchema.ts",
    "server/providers/apiyi.ts",
    "server/providers/apiyiTransport.ts",
    "server/providers/base.ts",
    "server/providers/exact.ts",
    "server/routes/aiDiagnostics.ts",
    "server/routes/generate.ts",
    "server/routes/runPlan.ts",
    "src/hooks/usePromptRunAdmission.ts",
    "src/lib/garmentPromptPresets.ts",
    "src/lib/nodeProductPolicy.ts",
    "src/lib/promptEvaluation.ts",
    "src/lib/promptEvaluationRelease.ts",
    "src/lib/promptEvaluationReleaseRegistry.ts",
    "src/lib/promptRunAdmission.ts",
    "src/lib/promptRuntimeShutdown.ts",
    "src/lib/providerPromptRenderer.ts",
    "src/lib/referenceEvidence.ts",
    "src/lib/referenceInputs.ts",
    "src/lib/referenceRoles.ts",
    "src/types/imageModels.ts",
    "src/types/modelParameterProfiles.ts",
    "src/types/promptEvaluation.ts",
    "src/types/retiredImageModels.ts",
    "src/types/workflow.ts"
  ],
  "sources": [
    {
      "canonicalUrl": "https://docs.apiyi.com/scenarios/ecosystem/coze-gptimage2-plugin",
      "snapshotRelativePath": "snapshots/2026-09-02T12-55-56.022Z-a90bb31d7f8c13df/pages/scenarios/ecosystem/coze-gptimage2-plugin.md",
      "pageLocalPath": "pages/scenarios/ecosystem/coze-gptimage2-plugin.md",
      "title": "GPT Image 2 Coze 插件",
      "sha256": "9cac91b7f7f7ec35eafe8c2686332f334a0391597f22bf66ba3fc5a565b5d462"
    },
    {
      "canonicalUrl": "https://docs.apiyi.com/api-capabilities/grok-imagine-image/overview",
      "snapshotRelativePath": "snapshots/2026-09-02T12-55-56.022Z-a90bb31d7f8c13df/pages/api-capabilities/grok-imagine-image/overview.md",
      "pageLocalPath": "pages/api-capabilities/grok-imagine-image/overview.md",
      "title": "Grok Imagine 2 生图/编辑",
      "sha256": "0e6d8fdd1ea3eca0225eea43182d655ba6d68d8c7bc644492c8a54ae8727b74a"
    },
    {
      "canonicalUrl": "https://docs.apiyi.com/live/archive",
      "snapshotRelativePath": "snapshots/2026-09-02T12-55-56.022Z-a90bb31d7f8c13df/pages/live/archive.md",
      "pageLocalPath": "pages/live/archive.md",
      "title": "实时动态归档",
      "sha256": "0a6eb4e1ff7ac9951bf673e9da1471a6a93eeea70b4f6720081e074334a23805"
    },
    {
      "canonicalUrl": "https://docs.apiyi.com/api-capabilities/image-prompt-doctor",
      "snapshotRelativePath": "snapshots/2026-09-02T12-55-56.022Z-a90bb31d7f8c13df/pages/api-capabilities/image-prompt-doctor.md",
      "pageLocalPath": "pages/api-capabilities/image-prompt-doctor.md",
      "title": "出图提示词诊断技能",
      "sha256": "f880d3a855819a5001cd4a31fb0d54992c4239ef267bb2ed3a03f7b70c468ec9"
    },
    {
      "canonicalUrl": "https://docs.apiyi.com/api-capabilities/seedance2/overview",
      "snapshotRelativePath": "snapshots/2026-09-02T12-55-56.022Z-a90bb31d7f8c13df/pages/api-capabilities/seedance2/overview.md",
      "pageLocalPath": "pages/api-capabilities/seedance2/overview.md",
      "title": "Seedance 2.0 / 2.5 视频生成",
      "sha256": "6cfb74f5750a6aa90881bd2963c7cf823a9b7f5c95db29979394d465cb1da49f"
    },
    {
      "canonicalUrl": "https://docs.apiyi.com/api-capabilities/gpt-image-2/overview",
      "snapshotRelativePath": "snapshots/2026-09-02T12-55-56.022Z-a90bb31d7f8c13df/pages/api-capabilities/gpt-image-2/overview.md",
      "pageLocalPath": "pages/api-capabilities/gpt-image-2/overview.md",
      "title": "GPT-Image-2 生图/编辑",
      "sha256": "ed653fdc134c607049eda8ec5aae83f605e66b176609a3ca1994278d59ee9988"
    },
    {
      "canonicalUrl": "https://docs.apiyi.com/live/2026-08/gpt-image-2-vip-429-retry",
      "snapshotRelativePath": "snapshots/2026-09-02T12-55-56.022Z-a90bb31d7f8c13df/pages/live/2026-08/gpt-image-2-vip-429-retry.md",
      "pageLocalPath": "pages/live/2026-08/gpt-image-2-vip-429-retry.md",
      "title": "gpt-image-2-vip 存在饱和，429 可重试、内容安全无需重试",
      "sha256": "ab04bf2e4c67dcb3e06670a86908c5a0f0cf7e236b5372ab7eb04f9dbe70f188"
    },
    {
      "canonicalUrl": "https://docs.apiyi.com/news/grok-imagine-2-launch",
      "snapshotRelativePath": "snapshots/2026-09-02T12-55-56.022Z-a90bb31d7f8c13df/pages/news/grok-imagine-2-launch.md",
      "pageLocalPath": "pages/news/grok-imagine-2-launch.md",
      "title": "Grok Imagine 2 图片模型上线：附完整实测",
      "sha256": "ad2e4b7e440965d1fe64a34f85644649ca50999e61cec79f1a41051c655c6ddf"
    }
  ],
  "decisionSummary": "按用户确认的顺序继续当前五模型与节点契约：现役 ID 精确固定为 gpt-image-2、gpt-image-2-vip、gemini-3.1-flash-image、flux-2-pro、seedream-5-0-260128；gpt-image-2 仅用于局部蒙版编辑，其余节点、参考图角色、提示词预设、Provider 参数、同步长请求、未知结果和评估发布继续遵守本地受审契约。保留 reviewedExportSha256 与原始导出 SHA-256 基线，不调用任何图片生成或编辑端点；Node 基线对齐为 24.20.0。Undici 8 请求级 dispatcher 保持不变，仅在单一适配边界桥接其 Fetch 标准响应类型与 DOM Response 类型。本次凭证重绑定当前未提交差异与离线门禁，无未决产品选项。",
  "unresolvedChoices": []
}
