{
  "schemaVersion": 1,
  "createdAt": "2026-09-06T15:00:05.719Z",
  "baseCommit": "b9b051f72fb9e0ce5514f8b646e9e3068ff9359c",
  "changeFingerprintSha256": "19777ee7dd075ec2d122a52577774a78a0db5c3eaa7c0c45e3c6524e20fd6e68",
  "knowledgeSnapshotId": "2026-09-02T12-55-56.022Z-a90bb31d7f8c13df",
  "knowledgeSnapshotSha256": "a90bb31d7f8c13df5505179dc18bfcaeba35f5344c2f624f75ac48ebf3c5e7a8",
  "query": "API易 当前工作树 Codex 门禁 E2E 参数透传 复核范围统计 Node.js 向上兼容 Provider 模型契约 提示词 评估发布 离线校验",
  "affectedPaths": [
    "docs/ai/apiyi/README.md",
    "docs/ai/apiyi/async-runtime.md",
    "docs/ai/apiyi/change-scope.json",
    "docs/ai/apiyi/evidence/2026-09-02-model-catalog-probe.json",
    "docs/ai/apiyi/evidence/2026-09-03-five-model-catalog-review.json",
    "docs/ai/apiyi/evidence/2026-09-03-manual-model-catalog-review.json",
    "docs/ai/apiyi/evidence/2026-09-03-model-catalog-probe.json",
    "docs/ai/apiyi/model-contracts.json",
    "docs/ai/apiyi/model-knowledge.json",
    "docs/ai/apiyi/models/flux-2-pro.md",
    "docs/ai/apiyi/models/gemini-3.1-flash-image.md",
    "docs/ai/apiyi/models/gpt-image-2-vip.md",
    "docs/ai/apiyi/models/gpt-image-2.md",
    "docs/ai/apiyi/models/grok-imagine-image.md",
    "docs/ai/apiyi/models/seedream-5-0-260128.md",
    "docs/ai/apiyi/project-guidance.json",
    "docs/ai/apiyi/reviews/2026-09-02-contract-rebuild.md",
    "docs/ai/apiyi/reviews/2026-09-03-five-model-catalog-review.md",
    "docs/ai/apiyi/reviews/2026-09-03-five-model-scope.md",
    "docs/ai/apiyi/reviews/2026-09-03-manual-model-catalog-review.md",
    "docs/ai/apiyi/reviews/2026-09-03-model-catalog-drift.md",
    "docs/ai/apiyi/site/README.md",
    "docs/ai/apiyi/site/current.json",
    "docs/ai/apiyi/sources.json",
    "docs/ai/evaluation/README.md",
    "docs/ai/evaluation/evaluation-manifest-v1.json",
    "docs/ai/evaluation/evaluation-plan-v1.json",
    "docs/ai/evaluation/evaluation-plan-v2.json",
    "docs/ai/evaluation/golden-set-v1.json",
    "docs/ai/evaluation/node-prompt-parameter-matrix-v1.json",
    "docs/ai/evaluation/prompt-release-registry.json",
    "scripts/apiyi-docs.mjs",
    "scripts/apiyi-kb.mjs",
    "scripts/build-server.ts",
    "scripts/codex-gate.mjs",
    "scripts/evaluation-authorize.ts",
    "scripts/evaluation-manifest.ts",
    "scripts/evaluation-release-preflight.ts",
    "scripts/evaluation-review.ts",
    "scripts/lib/apiyi-knowledge-base.mjs",
    "scripts/node-prompt-parameter-matrix.ts",
    "scripts/write-build-identity.mjs",
    "server/config.ts",
    "server/engine/dag.ts",
    "server/engine/runQueue.ts",
    "server/engine/runner.ts",
    "server/lib/evaluationAuthorizationLedger.ts",
    "server/lib/evaluationCampaign.ts",
    "server/lib/evaluationCodeIdentity.ts",
    "server/lib/evaluationEvidence.ts",
    "server/lib/evaluationEvidenceStore.ts",
    "server/lib/evaluationPromotion.ts",
    "server/lib/evaluationReleaseBuild.ts",
    "server/lib/evaluationReleaseBundle.ts",
    "server/lib/evaluationReleaseRuntime.ts",
    "server/lib/evaluationReviewLedger.ts",
    "server/lib/evaluationRunPolicy.ts",
    "server/lib/generationRecords.ts",
    "server/lib/imageReferenceAccess.ts",
    "server/lib/imageValidation.ts",
    "server/lib/referenceRolePrompt.ts",
    "server/lib/workflowSchema.ts",
    "server/providers/apiyi.ts",
    "server/providers/apiyiTransport.ts",
    "server/providers/base.ts",
    "server/providers/exact.ts",
    "server/routes/aiDiagnostics.ts",
    "server/routes/generate.ts",
    "server/routes/runPlan.ts",
    "src/hooks/usePromptRunAdmission.ts",
    "src/lib/garmentPromptPresets.ts",
    "src/lib/nodeProductPolicy.ts",
    "src/lib/promptEvaluation.ts",
    "src/lib/promptEvaluationRelease.ts",
    "src/lib/promptEvaluationReleaseRegistry.ts",
    "src/lib/promptRunAdmission.ts",
    "src/lib/promptRuntimeShutdown.ts",
    "src/lib/providerPromptRenderer.ts",
    "src/lib/referenceEvidence.ts",
    "src/lib/referenceInputs.ts",
    "src/lib/referenceRoles.ts",
    "src/types/imageModels.ts",
    "src/types/modelParameterProfiles.ts",
    "src/types/promptEvaluation.ts",
    "src/types/retiredImageModels.ts",
    "src/types/workflow.ts"
  ],
  "sources": [
    {
      "canonicalUrl": "https://docs.apiyi.com/scenarios/programming/codex-cli",
      "snapshotRelativePath": "snapshots/2026-09-02T12-55-56.022Z-a90bb31d7f8c13df/pages/scenarios/programming/codex-cli.md",
      "pageLocalPath": "pages/scenarios/programming/codex-cli.md",
      "title": "OpenAI Codex",
      "sha256": "8e43bf7d8d777b13dafdb11ead00c5731b1d1bdec42ee65333a55e797aa5431f"
    },
    {
      "canonicalUrl": "https://docs.apiyi.com/zh-Hant/scenarios/programming/codex-cli",
      "snapshotRelativePath": "snapshots/2026-09-02T12-55-56.022Z-a90bb31d7f8c13df/pages/zh-Hant/scenarios/programming/codex-cli.md",
      "pageLocalPath": "pages/zh-Hant/scenarios/programming/codex-cli.md",
      "title": "OpenAI Codex",
      "sha256": "292e2819c7e632c7f560f97c7019cf76647babe2944bd56d555ea5ec5ed92bbf"
    },
    {
      "canonicalUrl": "https://docs.apiyi.com/en/scenarios/programming/codex-cli",
      "snapshotRelativePath": "snapshots/2026-09-02T12-55-56.022Z-a90bb31d7f8c13df/pages/en/scenarios/programming/codex-cli.md",
      "pageLocalPath": "pages/en/scenarios/programming/codex-cli.md",
      "title": "OpenAI Codex",
      "sha256": "97aa7d9978a56cfbffd886e958f266fb78a7a71ff5e1db28dbdb36acb1dfb336"
    },
    {
      "canonicalUrl": "https://docs.apiyi.com/live/2026-04/codex-cli-docs-updated",
      "snapshotRelativePath": "snapshots/2026-09-02T12-55-56.022Z-a90bb31d7f8c13df/pages/live/2026-04/codex-cli-docs-updated.md",
      "pageLocalPath": "pages/live/2026-04/codex-cli-docs-updated.md",
      "title": "Codex 接入 API易 文档已更新，接入更简单",
      "sha256": "8fceb782f251ff7a418cf284c9bda8549ecf4aecf81e384d6f8215ef8d392d98"
    },
    {
      "canonicalUrl": "https://docs.apiyi.com/ko/scenarios/programming/codex-cli",
      "snapshotRelativePath": "snapshots/2026-09-02T12-55-56.022Z-a90bb31d7f8c13df/pages/ko/scenarios/programming/codex-cli.md",
      "pageLocalPath": "pages/ko/scenarios/programming/codex-cli.md",
      "title": "OpenAI Codex",
      "sha256": "b2b5989b65aee9431406f7d308187dd9e24a4ddabe227935b476c286636680d7"
    },
    {
      "canonicalUrl": "https://docs.apiyi.com/ja/scenarios/programming/codex-cli",
      "snapshotRelativePath": "snapshots/2026-09-02T12-55-56.022Z-a90bb31d7f8c13df/pages/ja/scenarios/programming/codex-cli.md",
      "pageLocalPath": "pages/ja/scenarios/programming/codex-cli.md",
      "title": "OpenAI Codex",
      "sha256": "5325a38d1219b6de700dd06d63eb612098d0ebb4ec39e419d03a91133cdc7840"
    },
    {
      "canonicalUrl": "https://docs.apiyi.com/ru/scenarios/programming/codex-cli",
      "snapshotRelativePath": "snapshots/2026-09-02T12-55-56.022Z-a90bb31d7f8c13df/pages/ru/scenarios/programming/codex-cli.md",
      "pageLocalPath": "pages/ru/scenarios/programming/codex-cli.md",
      "title": "OpenAI Codex",
      "sha256": "add5fae87f8d67cb09461e57c3597e2db313b9451cefe172bfc7d062cef2090c"
    },
    {
      "canonicalUrl": "https://docs.apiyi.com/live/2026-08/ai-agent-integration-prompts",
      "snapshotRelativePath": "snapshots/2026-09-02T12-55-56.022Z-a90bb31d7f8c13df/pages/live/2026-08/ai-agent-integration-prompts.md",
      "pageLocalPath": "pages/live/2026-08/ai-agent-integration-prompts.md",
      "title": "13 个图片 / 视频模型上线「AI Agent 开发提示词」，复制一段话让 Codex 帮你接入",
      "sha256": "b51e267876d62ebe747f72265c0e1066aaa547c258cc04ea642429d022567ad0"
    }
  ],
  "decisionSummary": "保留五个现役模型、精确模型 ID、reviewedExportSha256、Provider 请求、提示词、参考图角色和评估发布契约不变；仅修复 E2E 包装器消费本地 --skip-build 后再透传合法 Playwright 参数，以及 Codex 复核范围按真实文件数与字节数汇总省略证据。Node.js 24.20.0 继续作为最低可复现基线，并兼容更高版本；不调用任何图片生成或编辑端点。",
  "unresolvedChoices": []
}
